request,response
"Всё началось с небольшого недоразумения, а затем всё так быстро вышло из-под контроля. Мы оба наговорили друг другу обидных слов. Я никогда не ожидал, что наша ссора перерастёт в такое. Кажется, наша дружба распадается на глазах.","Похоже, эта ситуация сильно на тебя повлияла. Я понимаю, как это может быть удручающе — наблюдать, как отношения ухудшаются. Как это отразилось на твоих эмоциях?"
"Спасибо. Ваша поддержка очень важна для меня. Я готов работать над собой и смело встречать боль. Мне надоело жить в тьме, и я готов вернуться к свету.","Я здесь для тебя. Помни, что исцеление требует времени, и это путь, уникальный для каждого человека. Вместе мы пройдем этот путь к восстановлению и поможем тебе заново обрести смысл и счастье."
"Да, определенно есть факторы, которые играют свою роль. Стрессовые дни на работе, социальные мероприятия и даже чувство одиночества — это все ситуации, когда я обращаюсь к алкоголю. Он дает временное облегчение, но я глубоко внутри понимаю, что это не здоровый способ справляться с проблемами.","Я понимаю, как эти триггеры могут влиять на ваши привычки в питье. Важно выявить более здоровые способы справляться с этими чувствами, которые будут более устойчивыми. Пробовали ли вы какие-то альтернативы, чтобы справиться со стрессом или найти комфорт в такие моменты?"
Я буду это иметь в виду. Я ценю вашу помощь и поддержку в этом путешествии. Я начинаю осознавать потенциал нового хобби как способа трансформировать свою злость и травму.,"Я рад это слышать. Для меня большая честь сопровождать тебя на этом пути исцеления. Помни, я всегда рядом, чтобы выслушать тебя, когда тебе нужно поделиться своими успехами, неудачами или любыми эмоциями, которые возникают в этом процессе. Ты не один в этом."
"Я еще не до конца определился со своими мыслями, но хочу выразить, как их конфликты влияют на меня эмоционально, и предложить, что консультации могут помочь нам исцелиться и укрепить наши отношения.","Здорово, что ты обдумываешь, что хочешь сказать. Как, по-твоему, могла бы твояя семья отреагировать на твоё предложение?"
"Спасибо, что ты рядом со мной. Это значит больше, чем можно выразить словами. Я постараюсь делать небольшие шаги к своим мечтам, даже в те дни, когда это кажется невозможным. Я искренне надеюсь, что однажды моя мечта стать художником станет реальностью.","Я не сомневаюсь, что со временем и терпением вы сможете осуществить свою мечту. Помните, что прогресс не всегда идет по прямой, и неудачи — естественная часть пути. Но пока вы продолжаете верить в себя и опираться на поддержку окружающих, у вас есть бесконечный потенциал для исцеления и роста."
"Привет, надеюсь, у тебя сегодня все хорошо. Я в последнее время чувствую себя ужасно уставшим, как морально, так и физически. У меня внутри есть конфликт, от которого не могу избавиться.","Привет. Мне жаль узнать, что ты чувствуешь себя истощенным и морально, и физически. Когда мы уставшие, это нелегко. Можешь рассказать немного подробнее о конфликте, с которым ты сталкиваешься?"
"В последнее время я постоянно чувствую усталость и нехватку энергии. Это сказывается на моей повседневной жизни, и я испытываю разочарование, потому что не могу справляться с делами, которые раньше давались мне с легкостью.","Я понимаю, как это может быть неприятно. Мы вместе поработаем над тем, чтобы найти решения. Вы заметили какие-либо закономерности или триггеры, которые могут способствовать вашему усталости?"
"Это вызывает во мне глубокий отклик. Я осознал, что именно путь и переживания, которые мы приобретаем на нем, имеют настоящее значение. Результат уходит на второй план по сравнению с тем удовольствием, которое я испытываю в процессе изучения и занятия новыми увлечениями.","Абсолютно. Главное — быть в текущем моменте и наслаждаться ощущениями, которые возникают во время занятия хобби. Мне интересно, думали ли вы уже о каких-то конкретных хобби, которые хотели бы исследовать?"
"Я верю, что это будет развиваться. В процессе переживания утраты и исцеления я ожидаю, что моя потребность в зависимости постепенно уменьшится. Я смогу открыть и развить в себе больше внутренней силы и устойчивости на этом пути.","Это важный аспект процесса исцеления. Развитие внутренней силы и стойкости может быть преобразующим. Как вы представляете, как этот рост будет развиваться для вас?"
"Как будто между мной и моими эмоциями стоит преграда. Раньше я мог легко и открыто выражать себя, а теперь все затянуто туманом, который затмевает всё. Я чувствую, что просто выполняю действия, но в глубине души на самом деле не присутствую.","Это должно быть трудно переживать. Были ли какие-то конкретные ситуации или события, которые, по вашему мнению, могли способствовать этой тупости и трудностям в общении?"
"Кажется, что каждый раз, когда я пытаюсь высказать свои мысли или принять собственное решение, это встречает только неодобрение и критику. Будь то мои карьерные выборы или образ жизни, моя семья всегда имеет свое мнение по каждому поводу. Такое чувство, что мне никогда не удается сделать что-то правильно.","Это действительно непросто. Ужасно, когда люди, которых мы любим и о которых заботимся, не поддерживают нас без условий. Ты пробовал поговорить с ними о том, как их критика влияет на твои чувства?"
"Не знаю, с чего начать. В последнее время я испытываю ярость и панические атаки. Кажется, что мне не повезло в личной жизни.","Я тебя понимаю. Похоже, ты сейчас действительно испытываешь трудности. Можешь рассказать мне больше о том, что происходит в твоих отношениях?"
"Привет. Я чувствую себя в шоке и перегруженной. Я думаю, что пережила некоторое серьезное травматическое событие в своей жизни, и это сказывается на мне.","Привет. Достигнуть точки, когда ты решаешься обратиться за помощью, требует смелости, и я рад, что ты это сделал. Я хочу, чтобы ты знал, что я готов выслушать и поддержать тебя. Травмы могут оказать глубокое влияние на наши жизни, и это может быть подавляющим. Можешь рассказать немного больше о том, через что ты сейчас проходишь?"
"Привет. Не могу не испытывать неуверенности в себе, и моя самооценка достигла рекордно низкого уровня.","Привет, я здесь, чтобы тебя выслушать. Открыться и говорить о своих чувствах требует смелости. Можешь рассказать, что у тебя происходит?"
"Я ценю твою поддержку. Я определенно попытаюсь заняться медитацией осознанности. Я надеюсь, что это поможет мне снизить уровень стресса и в целом улучшить состояние.","Вот это настрой! Сохранение надежного мышления может существенно помочь в преодолении проблем со здоровьем. Не забывай отмечать даже маленькие победы на этом пути. Я здесь, чтобы поддерживать тебя на этом пути к лучшему здоровью."
"Определенно. В последнее время я чувствую себя подавленным из-за постоянного давления, чтобы успеть в срок и показать свои лучшие результаты. Объем работы стремительно растет, и мне кажется, что я всегда пытаюсь поймать дыхание. Я переживаю, что если это продолжится, это начнет сказываться на моем общем благополучии.","Похоже, что рабочая нагрузка вызывает у тебя значительный стресс. Я благодарен тебе за то, что ты поделился этим со мной. Давайте углубимся в эту тему. Какие конкретные ситуации или задачи вызывают это чувство срочности и давления?"
"Мысль о том, чтобы обратиться к кому-то в школе, вызывает у меня ещё больший страх. Я беспокоюсь, что меня сочтут слабым или неспособным. Мне трудно открываться другим по поводу своей тревоги, потому что боюсь их суждений. Я чувствую себя запертым в этом бесконечном круге страха и беспокойства.","Я понимаю ваши беспокойства. Поделиться своими уязвимостями, особенно когда речь идет о тревоге, требует много смелости. Тем не менее, обратиться за поддержкой может быть важным шагом к тому, чтобы справиться с тревожностью и найти необходимые ресурсы. Есть ли в школе кто-то, кому вы доверяете и кто мог бы оказать поддержку и понимание?"
"Я думаю, что для начала этот разговор действительно был полезным. Чувствуется облегчение, когда можешь открыться о своих тревогах и когда кто-то по-настоящему слушает. Спасибо, что создали безопасное пространство для меня, чтобы поделиться. Я уже чувствую себя немного легче и с нетерпением жду, когда смогу присоединиться к этому пути к исцелению.","Мне радостно слышать, что этот разговор был для тебя полезен. Открываться и делиться — это смело, и для меня большая честь быть здесь для тебя. Помни, что исцеление требует времени, это непрерывный процесс. Отмечай небольшие победы на этом пути и проявляй терпение к себе. Я всегда здесь, когда тебе нужно поговорить. Береги себя и продолжай двигаться вперед в этом путешествии исцеления и самопознания. Ты не один."
"Когда я смотрю назад, меня радуют именно простые моменты. Смех с близкими, время, проведенное на природе, или выполнение мелких задач, которые способствовали моему благополучию. В те времена я чувствовал себя по-настоящему счастливым.","Прекрасно, что ты осознаешь силу простоты и связи. Эти моменты могут напоминать о том, что радость скрыта в повседневных впечатлениях. Поскольку мы стремимся к твоему выздоровлению, давай подумаем о том, как можно добавить такие моменты в твою жизнь уже сейчас. Как ты можешь создать больше таких моментов сегодня?"
"Привет, надеюсь, у тебя всё хорошо. Сегодня у меня светлые мысли, несмотря на тяжёлый разрыв. Это было действительно сложно, но я верю, что мечты все равно могут сбываться, даже после расставания.","Привет, я рад слышать, что ты чувствуешь надежду, несмотря на те трудности, с которыми сталкиваешься. Разводы могут быть невероятно тяжелыми, и это нормально — испытывать смесь эмоций в этот период. Можешь рассказать мне больше о своих мечтах?"
"Да. Одним из основных факторов является страх осуждения со стороны коллег. Раньше я чувствовал себя уверенно в своих способностях, но после развода я стал переживать, что другие могут видеть меня иначе. Этот страх мешает мне активно участвовать в рабочих процессах, и я постоянно сомневаюсь в своих силах.","Я понимаю, почему ты так себя чувствуешь. Развод действительно может вызывать чувство уязвимости, и страх осуждения бывает довольно подавляющим. Важно помнить, что твоя ценность как профессионала не определяется твоим семейным положением. Как ты думаешь, что мы можем сделать, чтобы повысить твою уверенность в себе на работе?"
"Во время семейных встреч возникало много споров, и у меня сложилось впечатление, что мои мнения постоянно игнорируют. Кажется, что мой голос не имеет значения.","Это действительно непросто. Важно, чтобы каждый в семье чувствовал себя услышанным и ценным. Ты пробовал выражать свои чувства и беспокойства своим близким?"
"Спасибо. Ваша поддержка много значит для меня. Вместе мы сможем преодолеть зависимость и построить жизнь, о которой мы оба мечтаем - полную смысла, радости и благодарности.","Пожалуйста. Помни, у тебя есть внутренняя сила, чтобы создать ту жизнь, которую ты заслуживаешь. Давайте продолжим этот путь вместе, сосредоточившись на твоем росте и принимая возможности, которые ждут впереди."
"На самом деле, я никогда особо не задумывался об этом. Я всегда был слишком сосредоточен на школе и не имел времени ни на что другое. Но возможно, попробовать новое хобби может помочь мне отвлечься и найти нужный баланс в жизни.","Это отличное мышление. Изучение новых увлечений может стать замечательным способом отвлечься от школьного стресса и открыть для себя новые увлечения. Есть ли что-то конкретное, что тебя интересует или что ты хотел бы попробовать?"